{
  "schema_version": 1,
  "soc_name": "ascend310p",
  "display_name": "Ascend 310P (Atlas 300I Pro / DaVinci v1.5 inference)",
  "isa_generation": "davinci_v15",
  "aliases": ["310p", "ascend310p3"],
  "provisional": false,
  "notes": "Inference-oriented part. Fused Cube+Vector core: a Vector epilogue does not overlap Cube work on the same core (decoupled_vector_core=false). LPDDR-class memory: same burst width as 910B but materially higher MTE2/MTE3 latencies. Source: ascend-pipesim Phase 1 frozen constants; the static analyzer has no v1.5 profile yet, so audit-layer fields (event-id reservations, register width) are omitted rather than invented.",
  "system": {
    "ai_cores": 8,
    "cube_cores": 8,
    "vector_cores": 8,
    "core_freq_mhz": 1080,
    "l2_cache_bytes": 8388608,
    "hbm_bandwidth_gbps": 204.8,
    "decoupled_vector_core": false
  },
  "access_block_bytes": 32,
  "memory_domains": {
    "GM": {
      "size_bytes": 68719476736,
      "alignment_bytes": 512,
      "ports": 2,
      "description": "Off-chip LPDDR; 512 B burst alignment."
    },
    "L1": {
      "size_bytes": 524288,
      "alignment_bytes": 32,
      "size_alignment_bytes": 32,
      "stride_alignment_bytes": 32,
      "ports": 2,
      "description": "Cube-local scratchpad staging GM tiles before MTE1."
    },
    "L0A": {
      "size_bytes": 65536,
      "alignment_bytes": 512,
      "size_alignment_bytes": 512,
      "stride_alignment_bytes": 32,
      "description": "Cube left-matrix operand buffer, Zz fractal layout."
    },
    "L0B": {
      "size_bytes": 65536,
      "alignment_bytes": 512,
      "size_alignment_bytes": 512,
      "stride_alignment_bytes": 32,
      "description": "Cube right-matrix operand buffer, Nz fractal layout."
    },
    "L0C": {
      "size_bytes": 131072,
      "alignment_bytes": 1024,
      "size_alignment_bytes": 1024,
      "stride_alignment_bytes": 32,
      "element_bytes": 4,
      "description": "FP32/INT32 accumulator; 4 B per element."
    },
    "UB": {
      "size_bytes": 196608,
      "alignment_bytes": 32,
      "size_alignment_bytes": 32,
      "stride_alignment_bytes": 32,
      "banks": 8,
      "bank_stride_bytes": 32,
      "ports": 2,
      "description": "Unified Buffer: vector scratchpad, 8 banks x 32 B interleave. DaVinci v1.5 physical limit (192 KiB); explicit baseline per ground truth."
    }
  },
  "transfer_channels": {
    "MTE2": {
      "src": "GM", "dst": "L1",
      "bandwidth_bytes_per_cycle": 64.0,
      "base_latency_cycles": 280.0,
      "min_burst_bytes": 512,
      "max_outstanding": 8,
      "description": "GM -> L1 load; LPDDR-class latency."
    },
    "MTE2_UB": {
      "src": "GM", "dst": "UB",
      "bandwidth_bytes_per_cycle": 64.0,
      "base_latency_cycles": 280.0,
      "min_burst_bytes": 512,
      "max_outstanding": 8,
      "description": "GM -> UB load for Vector-side operands."
    },
    "MTE1": {
      "src": "L1", "dst": "L0A",
      "bandwidth_bytes_per_cycle": 64.0,
      "base_latency_cycles": 20.0,
      "min_burst_bytes": 32,
      "max_outstanding": 4,
      "description": "L1 -> L0A/L0B fractal load."
    },
    "FIXPIPE": {
      "src": "L0C", "dst": "GM",
      "bandwidth_bytes_per_cycle": 64.0,
      "base_latency_cycles": 80.0,
      "min_burst_bytes": 32,
      "max_outstanding": 4,
      "description": "L0C -> GM/UB drain with inline quant/dequant/ReLU."
    },
    "MTE3": {
      "src": "UB", "dst": "GM",
      "bandwidth_bytes_per_cycle": 64.0,
      "base_latency_cycles": 200.0,
      "min_burst_bytes": 512,
      "max_outstanding": 4,
      "description": "UB -> GM store; LPDDR-class latency."
    }
  },
  "compute_engines": {
    "cube": {
      "fractal_shape": {"m0": 16, "n0": 16, "k0": 16},
      "pipeline_latency_cycles": 16.0,
      "issue_overhead_cycles": 1.0,
      "dtype_profiles": {
        "fp16": {"k0": 16, "macs_per_cycle": 4096, "accumulator": "fp32"},
        "bf16": {"k0": 16, "macs_per_cycle": 4096, "accumulator": "fp32"},
        "int8": {"k0": 32, "macs_per_cycle": 8192, "accumulator": "int32"},
        "uint8": {"k0": 32, "macs_per_cycle": 8192, "accumulator": "int32"},
        "fp32": {"k0": 8, "macs_per_cycle": 1024, "accumulator": "fp32"}
      }
    },
    "vector": {
      "bytes_per_cycle": 128.0,
      "register_bytes": 256,
      "pipeline_latency_cycles": 8.0,
      "issue_overhead_cycles": 4.0
    },
    "scalar": {
      "pipeline_latency_cycles": 4.0
    }
  },
  "features": []
}
